uuid,name,description,class,shortname,child.1,child.2,child.3,child.4,child.5,child.6,child.7,child.8,child.9,child.10,child.11,child.12,child.13,child.14,child.15,child.16,child.17,child.18,child.19,child.20,reference-term-source,reference-term-code,reference-term-relationship
,"Chronic OPD Details, HPI",,Misc,HPI,"Chronic OPD Details, Location","Chronic OPD Details, Quality","Chronic OPD Details, Severity","Chronic OPD Details, Duration","Chronic OPD Details, Timing","Chronic OPD Details, Context","Chronic OPD Details, Modifying Factors","Chronic OPD Details, Associated Signs or Symptoms",,,,,,,,,,,,,,,
,"Chronic OPD Details, Menses",,Misc,Menses,"Chronic OPD Details, Date of LMP","Chronic OPD Details, Frequency","Chronic OPD Details, Regularity","Chronic OPD Details, Heavy / Light","Chronic OPD Details, Contraception",,,,,,,,,,,,,,,,,,
,"Chronic OPD Details, GU",,Misc,GU,"Chronic OPD Details, Urinary","Chronic OPD Details, Genital","Chronic OPD Details, Menses",,,,,,,,,,,,,,,,,,,,
,"Chronic OPD Details, ROS",,Misc,ROS,"Chronic OPD Details, Constitutional","Chronic OPD Details, Eyes","Chronic OPD Details, ENT","Chronic OPD Details, CV","Chronic OPD Details, Respair","Chronic OPD Details, GI","Chronic OPD Details, GU","Chronic OPD Details, MSK","Chronic OPD Details, Skin / Breast","Chronic OPD Details, Neuro","Chronic OPD Details, Psych","Chronic OPD Details, Endocrine","Chronic OPD Details, Heme / Lymph","Chronic OPD Details, Allergic / Immunologic",,,,,,,,,
,"Chronic OPD Details, Medications",,Misc,Current Medicines,"Chronic OPD Details, Current Home Medications","Chronic OPD Details, Non Compliance","Chronic OPD Details, Non Compliance Reason",,,,,,,,,,,,,,,,,,,,
,"Chronic OPD Details, Physical Examination",,Misc,Physical examination,"Chronic OPD Details, Physical Examination Details",,,,,,,,,,,,,,,,,,,,,,
,"Chronic OPD Details, Studies",,Misc,Studies,"Chronic OPD Details, Lab Studies","Chronic OPD Details, Radiology","Chronic OPD Details, EKG","Chronic OPD Details, Microbiology",,,,,,,,,,,,,,,,,,,
,"Chronic OPD Details, Assessment / Plan",,Misc,Assessment / Plan (Problem based),"Chronic OPD Details, Problem",,,,,,,,,,,,,,,,,,,,,,
,Chronic OPD Visit,,Misc,Chronic  OPD visit,"Chronic OPD Details, Chief Complaint","Chronic OPD Details, HPI","Chronic OPD Details, ROS","Chronic OPD Details, Medications","Chronic OPD Details, Allergies","Chronic OPD Details, Medical / Surgical History","Chronic OPD Details, Family History","Chronic OPD Details, Lives Where","Chronic OPD Details, Lives With","Chronic OPD Details, Work","Chronic OPD Details, Cigarette Smoker","Chronic OPD Details, Other Forms of Tobacco","Chronic OPD Details, Alcohol use","Chronic OPD Details, Evidence of Alcohol abuse","Chronic OPD Details, Illicit drug use","Chronic OPD Details, Physical Examination","Chronic OPD Details, Studies","Chronic OPD Details, Assessment / Plan",Followup,,,,
