uuid,name,description,class,datatype,shortname,answer.1,answer.2,answer.3,answer.4,answer.5,answer.6,answer.7,answer.8,answer.9,answer.10,answer.11,answer.12,answer.13,answer.14,answer.15,answer.16
,"Neurological Disorder, Symptoms",,Misc,Text,Symptoms,,,,,,,,,,,,,,,,
,"Neurological Disorder, Any Addiction",,Misc,Text,Any Addiction,,,,,,,,,,,,,,,,
,"Neurological Disorder, Disease(s)",,Misc,Text,Disease(s),,,,,,,,,,,,,,,,
,"Neurological Disorder, Last Visit Date",,Misc,Date,Last Visit Date,,,,,,,,,,,,,,,,
,"Neurological Disorder, BP Systolic",,Misc,Numeric,BP Systolic,,,,,,,,,,,,,,,,
,"Neurological Disorder, BP Diastolic",,Misc,Numeric,BP Diastolic,,,,,,,,,,,,,,,,
,"Neurological Disorder, On Treatment",,Misc,Boolean,On Treatment,,,,,,,,,,,,,,,,
,"Neurological Disorder, Treatment Details",,Misc,Text,Treatment Details,,,,,,,,,,,,,,,,
,"Neurological Disorder, Associated Disease(s)",,Misc,Text,Associated Disease(s),,,,,,,,,,,,,,,,
