uuid,name,class,datatype,shortname,description,reference-term-code,reference-term-relationship,reference-term-source,synonym.1,answer.1,answer.2,answer.3,answer.4,answer.5,answer.6,answer.7
,"Rheumatoid Arthritis, Joint Pain or Joint Swelling Today",Misc,Boolean,Patient has joint pain or joint swelling today,,,,,,,,,,,,
,"Rheumatoid Arthritis, Needs Acute Pain Management Today",Misc,Boolean,Patient needs acute pain management today,"Pain control -- NSAIDs: paracetamol 500mg po qid, and/or ibuprofen 400mg po tid.<br>
Acute flare w/ evidence of joint swelling or effusions -- prednisolone 10mg po daily x 7 days.<br>
** STOP prednisone and NSAIDs when disease control is achieved.<br>",,,,,,,,,,,
,"Rheumatoid Arthritis, Patient on Methotrexate",Misc,Boolean,Is patient on Methotrexate,"CONTRAINDICATIONS  pregnant, breast-feeding, patients with liver disease or alcohol intake, <br>
renal impairment, immunodeficiency syndrome<br>",,,,,,,,,,,
